<?xml version="1.0" encoding="UTF-8"?>

<mappings xsi:noNamespaceSchemaLocation="model-mapping.xsd"
			xmlns:xsi="http://www.w3.org/2001/XMLSchema-instance">
	<mapping name="PointMapping">
		<jsonAttribute jsonType="number" objectType="number">
			<jsonName>Student</jsonName>
			<mappingObject>id</mappingObject>
		</jsonAttribute>
		<jsonAttribute jsonType="number" objectType="number">
			<jsonName>bonus</jsonName>
			<mappingObject></mappingObject>
		</jsonAttribute>
		<jsonAttribute jsonType="number" objectType="number">
			<jsonName>malus</jsonName>
			<mappingObject>malus</mappingObject>
		</jsonAttribute>
	</mapping>
</mappings>